{
 "schema_version":1,
 "job_id":"blue-animatronic-v002",
 "title":"Reference-based blue animatronic v002 - editable rigged character test",
 "created_at":"2026-09-18T10:44:00Z",
 "script":"script.py",
 "source_blend":null,
 "timeout_seconds":1800,
 "preview":{"views":["front","right","back","three_quarter"],"width":900,"height":1000,"samples":32},
 "acceptance_criteria":[
  {"id":"C01","description":"Blender build exits successfully","kind":"automatic","check":"script_exit"},
  {"id":"C02","description":"Editable nonempty blend is saved","kind":"automatic","check":"blend_exists"},
  {"id":"C03","description":"Saved blend reopens and validates","kind":"automatic","check":"reopen_ok"},
  {"id":"C04","description":"Geometry and preview report exists","kind":"automatic","check":"report_exists"},
  {"id":"C05","description":"Front preview exists; all other requested previews must also pass worker gates","kind":"automatic","check":"preview:front"},
  {"id":"C06","description":"Four-view review: full body, rounded head, squat torso and segmented limbs broadly agree with reference proportions","kind":"review","check":"reference_proportions"},
  {"id":"C07","description":"Review two incisors, twin muzzle, striped glasses, ears, headphones, tuft, top hat, bow, pale bands and toes","kind":"review","check":"reference_features"},
  {"id":"C08","description":"Review separate editable parts and rigid armature; no missing or grossly detached major components","kind":"review","check":"editable_structure"}
 ],
 "review_required":true
}
